{
  "schema_version": 1,
  "publication": {
    "slug": "",
    "title": "",
    "authors": [],
    "year": null,
    "kind": null,
    "area": null,
    "date": null,
    "datePrecision": null,
    "dateBasis": "",
    "venue": "",
    "publication": "",
    "publisher": "",
    "pages": "",
    "links": [],
    "metadataSources": [],
    "citationKey": "",
    "selectedRank": null
  },
  "detail": {
    "slug": "",
    "zh_note": "Fill existing brief fields manually from the paper; never synthesize experimental results.",
    "en": {}
  },
  "review": {
    "state": "draft",
    "metadata_verified": false,
    "content_reviewed": false,
    "rights_reviewed": false,
    "publishable": false,
    "author_order": [],
    "evidence": []
  },
  "features": {
    "selectedRank": null,
    "researchArea": null,
    "figureRefs": [],
    "highlight": {
      "zh": "",
      "en": ""
    }
  },
  "figures": [],
  "provenance": []
}
